{
  "$schema": "https://json-schema.org/draft/2020-12/schema",
  "$id": "https://xcodebuildmcp.com/schemas/structured-output/xcodebuildmcp.output.doctor-report/1.schema.json",
  "title": "Doctor Report",
  "description": "Structured output envelope for environment and dependency diagnostics.",
  "type": "object",
  "additionalProperties": false,
  "allOf": [
    {
      "$ref": "https://xcodebuildmcp.com/schemas/structured-output/_defs/common.schema.json#/$defs/errorConsistency"
    }
  ],
  "properties": {
    "schema": {
      "const": "xcodebuildmcp.output.doctor-report"
    },
    "schemaVersion": {
      "const": "1"
    },
    "didError": {
      "type": "boolean"
    },
    "error": {
      "type": [
        "string",
        "null"
      ]
    },
    "data": {
      "anyOf": [
        {
          "type": "object",
          "additionalProperties": false,
          "properties": {
            "serverVersion": {
              "type": "string"
            },
            "checks": {
              "type": "array",
              "items": {
                "type": "object",
                "additionalProperties": false,
                "properties": {
                  "name": {
                    "type": "string"
                  },
                  "status": {
                    "enum": [
                      "ok",
                      "warning",
                      "error"
                    ]
                  },
                  "message": {
                    "type": "string"
                  }
                },
                "required": [
                  "name",
                  "status",
                  "message"
                ]
              }
            }
          },
          "required": [
            "serverVersion",
            "checks"
          ]
        },
        {
          "type": "null"
        }
      ]
    }
  },
  "required": [
    "schema",
    "schemaVersion",
    "didError",
    "error",
    "data"
  ]
}
