{
  "schema": "xcodebuildmcp.output.doctor-report",
  "schemaVersion": "1",
  "didError": false,
  "error": null,
  "data": {
    "summary": {
      "status": "SUCCEEDED",
      "generatedAt": "<TIMESTAMP>",
      "serverVersion": "<VERSION>",
      "outputMode": "Redacted (default)"
    },
    "environment": {
      "platform": "darwin",
      "release": "<OS_RELEASE>",
      "architecture": "arm64",
      "homeDirectory": "<HOME>",
      "tempDirectory": "<TMPDIR>",
      "nodeVersion": "<NODE_VERSION>",
      "cwd": "<CWD>",
      "processId": 99999,
      "parentProcessId": 99998
    },
    "tooling": {
      "xcodeVersion": "<XCODE_VERSION>",
      "xcodePath": "<XCODE_PATH>",
      "selectedXcodePath": "<XCODE_PATH>",
      "xcrunVersion": "<VERSION>",
      "axeVersion": "<VERSION>",
      "miseVersion": "<VERSION>"
    },
    "capabilities": {
      "uiAutomationAvailable": true,
      "simulatorVideoCaptureSupported": true,
      "incrementalBuildsEnabled": false,
      "incrementalBuildBinaryAvailable": true,
      "lldbDapAvailable": true,
      "selectedDebuggerBackend": "dap"
    },
    "manifestInventory": {
      "totalUniqueTools": 42,
      "workflowCount": 15,
      "workflows": {
        "coverage": 1,
        "debugging": 5,
        "device": 4,
        "doctor": 1,
        "macos": 4,
        "project-discovery": 3,
        "project-scaffolding": 1,
        "session-management": 2,
        "simulator-management": 8,
        "simulator": 7,
        "swift-package": 5,
        "ui-automation": 8,
        "utilities": 2,
        "workflow-discovery": 1,
        "xcode-ide": 2
      }
    },
    "diagnostics": {
      "warnings": [],
      "errors": []
    }
  }
}
